Word,Part of Speech,Definition,Difficulty
opulent,(adj.),characterized by great wealth, very expensive and comfortable,Easy
opulence,(n.),great wealth or extravagance,Easy
ornate,(adj.),elaborately decorated,Easy
oust,(v.),to force someone out of a position or place,Easy
outpace,(v.),to go faster than,Easy
outsize,(adj.),unusually large,Easy
overlook,(v.),to ignore or excuse,Easy
overrun,(v.),to invade and occupy in large numbers, to infest,Easy
overshadow,(v.),to exceed in importance or impressiveness,Easy
overstate,(v.),to exaggerate,Easy
overt,(adj.),done or shown openly; obvious,Easy
overwhelm,(v.),to overpower, to drown (lit. or ﬁg.),Easy
pacify,(v.),to make peaceful, to calm,Easy
painstaking,(adj.),very careful and thorough, involving conscientious eort,Easy
palatable,(adj.),pleasant-tasting or agreeable to the senses; acceptable,Easy
palatial,(adj.),resembling a palace, spacious and grand,Easy
paltry,(adj.),not suffcient, too small,Easy
partisan,(adj.),showing strong adherence to a particular group, cause, etc.,Easy
partisan,(n.),a strong supporter of a group, cause, etc.,Easy
pensive,(adj.),immersed in or involving deep thought,Easy
perennial,(adj.),continual or recurring,Easy
peripheral,(adj.),of minor or secondary importance; on the edge of something,Easy
periphery,(n.),an edge; a marginal position,Easy
permeate,(v.),to spread throughout,Easy
perplex,(v.),to make someone very confused,Easy
pervasive,(adj.),widespread, present everywhere,Easy
pervade,(v.),to spread throughout, to be in every part of,Easy
phenomenon,(n.),(an observable occurrence, esp. an interesting or signﬁcant one; someone or something that is very popular or impressive,Easy
picturesque,(adj.),pretty or charming in a way that calls to mind a painted scene,Easy
pioneering,(adj.),involving new ideas or methods, ﬁrst of its kind,Easy
placate,(v.),to calm the anger of, esp. by giving something wanted,Easy
placid,(adj.),calm, not easily excited; peaceful, undisturbed,Easy
plentiful,(adj.),existing in large quantities,Easy
ploy,(n.),a clever scheme designed to gain an advantage,Easy
pompous,(adj.),self-important, arrogant,Easy
portray,(v.),to show or describe (as in a work of art or writing); to play the role of,Easy
potent,(adj.),powerful or eective,Easy
precarious,(adj.),lacking security or stability,Easy
precede,(v.),to come before in time or order,Easy
predecessor,(n.),a person who had a job or position before someone else; something that predates something else of the same or similar kind,Easy
predispose,(v.),to make susceptible or inclined predominant / predominant,Easy
predispose,(adj.),most powerful, noticeable, inﬂuential, or common,Easy
predominate,(v.),to be the strongest, most numerous, or main element; to dominate,Easy
preeminent,(adj.),most important or outstanding,Easy
preempt,(v.),to prevent from happening,Easy
preponderance,(n.),a majority; an excess in number or quantity,Easy
presumptuous,(adj.),failing to observe the limits of what is polite or appropriate,Easy
pretentious,(adj.),having or showing the attitude of being better than others,Easy
pretext,(n.),a false reason given for doing something,Easy
prevailing,(adj.),current; most common or popular,Easy
prevail,(v.),to win; to be common or popular,Easy
prevalent,(adj.),widespread,Easy
pristine,(adj.),in its original condition; unspoiled, spotless,Easy
profound,(adj.),having or requiring intellectual depth; very great, intense, or far-reaching,Easy
profundity,(n.),intellectual depth; depth or intensity (of a feeling),Easy
proliferation,(n.),rapid increase in quantity,Easy
proliﬁc,(adj.),producing a large quantity of something,Easy
prominent,(adj.),important or noticeable,Easy
prominence,(n.),importance or noticeability,Easy
prone,(adj.),likely or tending to do, have, or suer from,Easy
propagate,(v.),to spread widely (of an idea, etc.),Easy
propensity,(n.),a tendency,Easy
prophetic,(adj.),predicting the future,Easy
proponent,(n.),a supporter, a person who argues in favor of something,Easy
propriety,(n.),conformity to socially acceptable behavior,Easy
prosper,(v.),to succeed or thrive (economically or physically),Easy
provocative,(adj.),causing a strong reaction such as excitement, argument, curiosity, etc.,Easy
prudent,(adj.),showing caution and good judgment,Easy
prudence,(n.),Wise and cautious judgment,Easy
pseudonym,(n.),a fake name, esp. one used by an author or artist,Easy
puzzle,(v.),to confuse,Easy
quirky,(adj.),unusual in an interesting way,Easy
radical,(adj.),unconventional and extreme, totally dierent from the norm,Easy
rash,(adj.),rushed or done without careful thought, hasty,Easy
ravage,(v.),to damage severely,Easy
reconcile,(v.),to make compatible or consistent; to settle a disagreement or restore friendly relations,Easy
reﬁned,(adj.),well-mannered and cultured; precise,Easy
refrain,(v.),to hold back from doing something,Easy
refuge,(n.),a safe place, a shelter,Easy
refute,(v.),to disprove or deny,Easy
refutation,(n.),the act of proving that something is not true or accurate,Easy
relish,(v.),to greatly enjoy,Easy
reminisce,(v.),to recall or recount a memorable past experience, esp. an enjoyable one,Easy
rendition,(n.),a performance or interpretation, a version,Easy
renowned,(adj.),well-known and admired,Easy
repercussion,(n.),a consequence, esp. a negative one,Easy
reprimand,(v.),to scold,Easy
reprimand,(n.),a scolding or formal expression of disapproval,Easy
resolute,(adj.),determined, purposeful (of a person),Easy
revoke,(v.),to cancel or take back something that is already in eect,Easy
revolutionize,(v.),to change greatly or completely,Easy
ridicule,(v.),to make fun of in a cruel or harsh way,Easy
rigorous,(adj.),very strict, thorough, or demanding,Easy
rigor,(n.),strictness; exactness,Easy
riveting,(adj.),completely fascinating,Easy
robust,(adj.),strong and healthy,Easy
rudimentary,(adj.),basic; not fully developed, not advanced,Easy
ruffe,(v.),to disturb the smoothness or calmness of,Easy
rural,(adj.),of or relating to the countryside,Easy
rustic,(adj.),of or suitable for the countryside; plain and simple (of furniture, clothing, etc.),Easy
ruthless,(adj.),showing no compassion or mercy, cruel,Easy
safeguard,(v.),to protect,Easy
safeguard,(n.),something that serves to protect, a precaution,Easy
salvage,(v.),to save something from being destroyed; to retrieve something enjoyable or valuable from wreckage,Easy
scant,(adj.),very little; not quite enough,Easy
scarce,(adj.),not plentiful, lacking,Easy
scathing,(adj.),severely critical,Easy
scorn,(n.),open dislike and disrespect,Easy
scorn,(v.),to treat as unworthy of respect; to reject,Easy
scrupulous,(adj.),principled in morals, ethical; thorough and exact,Easy
scrutinize,(v.),to closely examine, to inspect,Easy
scrutiny,(n.),careful and close examination,Easy
seldom,(adv.),rarely,Easy
sensationalize,(v.),to make something seem more exciting, interesting, or shocking than it is,Easy
sentimental,(adj.),emotional, esp. overly so; tenderly nostalgic,Easy
shoddy,(adj.),badly made or done; inferior,Easy
shortfall,(n.),a failure to reach an expectation or need; a deﬁcit,Easy
shortsighted,(adj.),lacking thought about the future,Easy
shrewd,(adj.),clever, having good judgment,Easy
shrewdness,(n.),cleverness, good judgment,Easy
shun,(v.),to completely reject or habitually avoid,Easy
skeptical,(adj.),disbelieving, having doubts,Easy
skepticism,(n.),an attitude of doubt or disbelief,Easy
skirt,(v.),to avoid, to go around; to border,Easy
skittish,(adj.),easily frightened, nervous or fearful,Easy
slander,(n.),a false statement that damages someone’s reputation,Easy
slander,(v.),to make a false and damaging statement about someone,Easy
sluggish,(adj.),slow-moving and lacking energy,Easy
smug,(adj.),overly pleased and satisﬁed with oneself,Easy
solicit,(v.),to ask for,Easy
somber,(adj.),very serious and sad , gloomy,Easy
sophisticated,(adj.),showing knowledge of arts and culture and/or experience in the ways of the world; highly developed, complex,Easy
sound,(adj.),logical and sensible; stable and reliable,Easy
spare,(adj.),extra; not plentiful,Easy
sparing,(adj.),not using or giving much,Easy
sparse,(adj.),scattered and few,Easy
spartan,(adj.),harshly simple and plain, lacking comforts,Easy
spawn,(v.),to produce, esp. in large numbers,Easy
spawn,(n.),ospring (lit. or ﬁg.),Easy
specious,(adj.),falsely seeming true or correct,Easy
speculation,(n.),a guess,Easy
speculate,(v.),to guess, to form ideas or theories about something without ﬁrm evidence,Easy
spendthrift,(adj.),wasteful and extravagant (of spending),Easy
spendthrift,(n.),someone who is wasteful with money,Easy
spiteful,(adj.),intending to harm or annoy, esp. because of petty resentment,Easy
sporadic,(adj.),occasional, infrequent,Easy
spur,(v.),to promote or encourage the development of, to stimulate into action,Easy
squander,(v.),to recklessly or foolishly waste,Easy
staggering,(adj.),very surprising, esp. because of largeness or impressiveness,Easy
stagnant,(adj.),not moving, ﬂowing, or progressing,Easy
stagnate,(v.),to stop moving, ﬂowing, or progressing,Easy
stark,(adj.),bare; very obvious or clear,Easy
static,(adj.),not moving or changing,Easy
steadfast,(adj.),loyal; unchanging,Easy
stern,(adj.),very serious and unsmiling; strict and ﬁrm,Easy
stigma,(n.),something that brings shame, often unfairly,Easy
stigmatize,(v.),to describe or regard as shameful or socially unacceptable,Easy
straightforward,(adj.),honest and direct; uncomplicated,Easy
stringent,(adj.),very strict,Easy
subjective,(adj.),based on personal opinion,Easy
sublime,(adj.),awe-inspiringly wonderful,Easy
subside,(v.),to become less intense or severe; to become silent or inactive,Easy
subsidize,(v.),to ﬁnancially support or assist,Easy
substantiate,(v.),to provide proof of, to verify,Easy
substantive,(adj.),meaningful and important; considerable,Easy
subtle,(adj.),not obvious or direct,Easy
suit,(v.),to be appropriate for, to go well with,Easy
sullen,(adj.),gloomily or angrily silent,Easy
superﬁcial,(adj.),shallow, surface-level (lit. or ﬁg.),Easy
superﬂuous,(adj.),unnecessary; extra,Easy
superﬂuity,(n.),an excess; the quality of being unnecessary,Easy
suppress,(v.),to prevent or put an end to by force, to inhibit; to keep secret,Easy
surpass,(v.),to exceed, to be greater than or better than,Easy
susceptible,(adj.),able to be aected or inﬂuenced,Easy
sweeping,(adj.),extensive, wide-ranging,Easy
synthesize,(v.),to combine into a cohesive whole; to produce by combining elements,Easy
tarnish,(v.),tarnish to become or make discolored or less shiny; to damage how something is perceived (of a reputation, etc.),Easy
tedious,(adj.),boring and too slow or long,Easy
tepid,(adj.),only slightly warm (lit. or ﬁg.), half-hearted,Easy
terse,(adj.),using few words, esp. to the point of rudeness,Easy
testament,(n.),evidence that something exists or is true,Easy
thrifty,(adj.),careful in the use of money,Easy
thrift,(n.),the careful use of money and other resources,Easy
tirade,(n.),a long, angry speech,Easy
tiresome,(adj.),annoyingly boring,Easy
tout,(v.),to talk up the merits of something, to praise and promote,Easy
trailblazer,(n.),Someone who is the ﬁrst to do something, an innovator,Easy
tranquil,(adj.),calm, quiet, and peaceful,Easy
transcend,(v.),to rise above or go beyond,Easy
treatise,(n.),a written work discussing a subject in a thorough and systematic way,Easy
trivial,(adj.),unimportant, insigniﬁcant,Easy
tyrant,(n.),an oppressive ruler with absolute power,Easy
undercut,(v.),to make weaker or less eective; to sell goods or services at prices lower than competitors’,Easy
underhanded,(adj.),acting or done in a secret and dishonest way; sneaky,Easy
undermine,(v.),to weaken, esp. gradually,Easy
underscore,(v.),to emphasize; to show to be important or true,Easy
understated,(adj.),restrained, subtle, or modest,Easy
understate,(v.),to state that something is smaller or less important than it really is,Easy
uniform,(adj.),unvarying, all the same,Easy
universal,(adj.),existing everywhere, all-encompassing,Easy
unseemly,(adj.),not proper or appropriate (of a behavior or action),Easy
uphold,(v.),to maintain something already in eect; to decide not to change something,Easy
uptick,(n.),a small increase,Easy
vacillate,(v.),to alternate between things; to go back and forth in deciding what to choose,Easy
verbose,(adj.),wordy,Easy
verbosity,(n.),wordiness,Easy
versed,(adj.),experienced in or knowledgeable about,Easy
vex,(v.),to annoy,Easy
vexation,(n.),an annoyance,Easy
viable,(adj.),able to live, function, or succeed,Easy
vibrant,(adj.),bright (of color); full of life and energy,Easy
vicarious,(adj.),felt through someone else’s experience,Easy
vigorous,(adj.),active, forceful, or energetic; strong and healthy,Easy
vigor,(n.),energy, force, and enthusiasm,Easy
vindicate,(v.),to free from blame; to prove right or justiﬁed,Easy
visionary,(n.),a person who thinks about the future in an imaginative and insightful way,Easy
visionary,(adj.),imaginative and insightful about the future; inventive,Easy
vital,(adj.),absolutely necessary or extremely important,Easy
vivid,(adj.),very bright (of color); producing strong mental images (of a description, dream, memory, etc.),Easy
volatile,(adj.),explosive or unstable, given to sudden or extreme changes,Easy
volatility,(n.),a tendency to change quickly,Easy
wane,(v.),to decrease in vigor, power, or extent; become weaker,Easy
wary,(adj.),very cautious and not trusting,Easy
wariness,(n.),cautiousness,Easy
waver,(v.),to go back and forth (lit. or ﬁg.), to be unsteady or undecided,Easy
whimsical,(adj.),playfully unusual or imaginative; changing suddenly and unpredictably,Easy
wield,(v.),to hold and use eectively (of a weapon, power, inﬂuence, etc.),Easy
zealous,(adj.),enthusiastic,Easy
zeal,(n.),enthusiasm,Easy
abate,(v.),to decrease in strength or intensity, esp. something negative,Medium
abdicate,(v.),to give up a position of power; to reject or abandon (responsibility or duty),Medium
abject,(adj.),extreme (of something negative such as poverty, fear, cowardice. etc.),Medium
acrimonious,(adj.),bitterly angry,Medium
acrimony,(n.),anger and bitterness,Medium
admonish,(v.),to warn or advise,Medium
adroit,(adj.),clever, skillful,Medium
advent,(n.),the arrival of something important,Medium
aesthetic,(adj.),relating to beauty or appearance,Medium
aesthetic,(n.),a particular sense of beauty or taste, esp. in a work of art, design, literature, etc.,Medium
affectation,(n.),behavior that is unnatural to oneself, esp. to impress others,Medium
aggrandize,(v.),to increase or make greater, esp. power, wealth, or reputation,Medium
aggrandizement,(n.),an increase; an enhancement in reputation, power, or wealth,Medium
akin,(adj.),alike, similar,Medium
allude,(v.),to hint at, to indirectly refer to,Medium
allusion,(n.),an indirect reference to something,Medium
amenable,(adj.),open to suggestion, persuadable,Medium
analogy,(n.),a comparison between two otherwise unlike things that are similar in a particular respect,Medium
analogous,(adj.),similar, comparable,Medium
anomaly,(n.),something unusual or unexpected,Medium
anomalous,(adj.),abnormal, unusual, or atypical,Medium
antipathy,(n.),strong dislike,Medium
antithesis,(n.),a direct opposite,Medium
antithetical,(adj.),directly opposed; incompatible,Medium
appreciable,(adj.),large enough to matter,Medium
artiﬁce,(n.),a clever trick or clever means to an end; insincere behavior,Medium
ascension,(n.),the act of rising to a higher level or position,Medium
ascend,(v.),to rise or climb,Medium
ascribe,(v.),to regard as coming from a particular person or thing, to attribute,Medium
attenuate,(v.),to weaken, reduce, or make thin,Medium
attenuation,(n.),a weakening, a reduction in force, size, or amount,Medium
audacious,(adj.),bold and daring, esp. in a risky way; boldly disrespectful,Medium
balk,(v.),to abruptly refuse; to refuse to proceed,Medium
baroque,(adj.),overly detailed and extravagant, overly complex,Medium
befuddle,(v.),to make confused,Medium
behemoth,(n.),something huge and powerful,Medium
belie,(v.),to give a false impression of; to contradict,Medium
belittle,(v.),to make somebody or something seem small or unimportant; put down,Medium
bellicose,(adj.),inclined or eager to ﬁght or start a war,Medium
belligerent,(adj.),aggressively angry, combative,Medium
bemoan,(v.),to express sadness or displeasure over; to complain about,Medium
bemuse,(v.),to make confused, esp. also slightly amused,Medium
beneﬁcent,(adj.),doing good or causing good to be done,Medium
bequeath,(v.),to pass on something to someone else,Medium
bombastic,(adj.),impressive-sounding but meaningless,Medium
bombast,(n.),speech or writing that is impressive-sounding but meaningless,Medium
boon,(n.),something helpful or beneﬁcial,Medium
boorish,(adj.),rude or ill-mannered,Medium
boor,(n.),a rude or ill-mannered person,Medium
brazen,(adj.),shamelessly bold,Medium
broach,(v.),to bring up (a sensitive subject),Medium
burgeon,(v.),to grow quickly,Medium
buttress,(v.),to support or strengthen, to prop up,Medium
buttress,(n.),a support,Medium
cacophony,(n.),a harsh mix of sounds,Medium
cacophonous,(adj.),involving a harsh mix of sounds,Medium
candid,(adj.),open and honest (of speech or writing),Medium
canny,(adj.),clever, showing smart judgment,Medium
capricious,(adj.),changing suddenly and often,Medium
caste,(n.),a social class,Medium
catalyst,(n.),a person or thing that causes a signiﬁcant change or action,Medium
catalyze,(v.),to bring about, to prompt,Medium
chastise,(v.),to scold severely,Medium
chauvinism,(n.),a belief that your gender or country is superior to all others,Medium
chauvinist,(adj.),biased in favor of one’s own gender; excessively patriotic,Medium
chivalrous,(adj.),courteous and honorable, esp. of men toward women; gentlemanly,Medium
circumspect,(adj.),thinking carefully before acting,Medium
clamorous,(adj.),loud and noisy, esp. also insistent,Medium
clamor,(v.),to loudly call for something to happen,Medium
clandestine,(adj.),hidden or done in secret, esp. because illegal,Medium
cliché,(n.),a thing that is too common or overused to be interesting anymore,Medium
cloister,(v.),to seclude,Medium
cloister,(n.),a convent or monastery, a secluded place or state,Medium
cloistered,(adj.),secluded, sheltered,Medium
coalesce,(v.),to come together to form a single whole,Medium
cogent,(adj.),clear and convincing, well-reasoned,Medium
cognitive,(adj.),relating to mental activities (thinking, learning, etc.),Medium
colloquial,(adj.),conversational, used when speaking in an informal way (of language),Medium
commensurate,(adj.),corresponding in amount or extent, proportionate,Medium
commodiﬁcation,(n.),the act of turning something priceless into a product that can be bought and sold,Medium
commodify,(v.),to turn into a product that can be bought and sold (of something that is generally not regarded as such),Medium
compendium,(n.),a collection of things presented together, esp. in a book,Medium
complacent,(adj.),smugly satisﬁed (with oneself or with a situation), esp. without awareness of dangers or deﬁciencies,Medium
concede,(v.),to reluctantly admit or give up something; to admit defeat,Medium
concession,(n.),a thing that is granted or given up to reach an agreement, or the act of granting or giving up such a thing; an admission of defeat,Medium
confer,(v.),to consult together, to exchange views in discussion; to give or grant (a characteristic, right, honor, etc.),Medium
conﬂate,(v.),to mistake one thing for another, to mistake two dierent things for the same thing,Medium
conﬂation,(n.),to combine separate things into one, esp. in a way that mistakes the things as the same,Medium
conformist,(n.),someone who follows the norm,Medium
conformist,(adj.),adhering to the norm, conventional,Medium
confound,(v.),to confuse or frustrate; to disprove,Medium
congenial,(adj.),friendly; pleasant,Medium
congeniality,(n.),friendliness; pleasantness,Medium
conjecture,(n.),an opinion based on incomplete evidence, a guess,Medium
consummate,(adj.),of the highest degree; perfect or extremely skilled,Medium
consummate,(v.),to complete,Medium
contrite,(adj.),remorseful,Medium
contrition,(n.),remorse and regret,Medium
convivial,(adj.),fond of or involving friendly socializing (of a person or atmosphere),Medium
coy,(adj.),sweetly shy; reluctant to reveal information,Medium
credulous,(adj.),overly willing to believe, easily fooled,Medium
curb,(v.),to restrain, to keep in check,Medium
cursory,(adj.),done quickly and without attention to detail,Medium
curtail,(v.),to reduce or cut short; to limit,Medium
dearth,(n.),a scarcity or lack of something,Medium
deify,(v.),to treat as a god,Medium
demystify,(v.),to make easy to understand, to clarify,Medium
deride,(v.),to make fun of and insult,Medium
despot,(n.),a cruel and oppressive ruler with absolute power,Medium
despotic,(adj.),relating to a cruel and oppressive ruler with absolute power,Medium
destitute,(adj.),penniless, extremely impoverished,Medium
diatribe,(n.),a long, angry speech or written work,Medium
dichotomy,(n.),a dierence between two opposite things; a division into two opposite groups,Medium
didactic,(adj.),Intended to teach; in the manner of a teacher, esp. in an annoying way,Medium
dilate,(v.),to widen or enlarge; to expand,Medium
disaffected,(adj.),discontented, esp. with authority; no longer willing to support,Medium
disavow,(v.),to deny responsibility for, support for, or connection with,Medium
disconcerting,(adj.),disturbing, unsettling,Medium
discreet,(adj.),careful not to attract attention or reveal sensitive information; not easily noticed,Medium
discrete,(adj.),separate and distinct,Medium
disingenuous,(adj.),not honest or sincere,Medium
disinterested,(adj.),not inﬂuenced by personal interest; impartial,Medium
dispassionate,(adj.),not inﬂuenced by emotions or personal involvement, calm and impartial,Medium
dissemble,(v.),to hide one’s true feelings, motives, etc.,Medium
dissident,(n.),someone who disagrees with the establishment, esp. in politics or religion,Medium
dissident,(adj.),disagreeing with the established system or government,Medium
dissipation,(n.),the process of spreading out, thinning out, or gradually disappearing; wasteful spending and self-indulgence,Medium
divulge,(v.),to make known, to reveal (something secret or private),Medium
doctrinaire,(adj.),stubbornly devoted to beliefs,Medium
doctrine,(n.),a set of beliefs or practices, esp. related to government or religion,Medium
dogmatic,(adj.),assertive and inﬂexible in one’s opinions or beliefs,Medium
dogma,(n.),a set of established beliefs,Medium
dupe,(v.),to trick, to fool,Medium
duplicitous,(adj.),deceitful,Medium
duplicity,(n.),double-dealing, deceitfulness,Medium
dynamism,(n.),energy and activity,Medium
dynamic,(adj.),strongly energetic; full of energetic activity, constantly changing,Medium
eclectic,(adj.),including elements from a variety of sources, composed of many dierent things,Medium
effectual,(adj.),eective,Medium
egalitarian,(adj.),relating to the belief that all people deserve equal rights,Medium
elate,(v.),to make very happy,Medium
elucidate,(v.),to clarify, to explain,Medium
elusive,(adj.),diffcult to ﬁnd, catch, or understand,Medium
embezzle,(v.),to steal an entity’s money for one’s own use,Medium
embezzlement,(n.),the act of stealing an entity’s money for one’s own use,Medium
emulate,(v.),to imitate,Medium
engender,(v.),to bring about, to cause,Medium
enigmatic,(adj.),mysterious or puzzling,Medium
ephemeral,(adj.),lasting for a very short time,Medium
epitome,(n.),a perfect example,Medium
epitomize,(v.),to be a perfect example of,Medium
equitable,(adj.),fair and just,Medium
equivocal,(adj.),open to interpretation, esp. deliberately vague; uncertain,Medium
equivocate,(v.),to use deliberately ambiguous or noncommittal language,Medium
erudite,(adj.),learned, well-educated or well-read,Medium
erudition,(n.),extensive knowledge acquired from books or academic study,Medium
eschew,(v.),to deliberately avoid using or partaking in, to reject,Medium
eschewal,(n.),a rejection or deliberate avoidance of something,Medium
estimable,(adj.),deserving great respect,Medium
estrange,(v.),to make no longer friendly, close, or associated,Medium
euphemism,(n.),an inoensive word or expression used in place of an unpleasant or embarrassing one, a polite term,Medium
euphoria,(n.),intense happiness and excitement,Medium
euphoric,(adj.),ﬁlled with intense happiness and excitement,Medium
exacting,(adj.),demanding; requiring careful attention and precision,Medium
exodus,(n.),a mass departure,Medium
exonerate,(v.),to free from blame,Medium
exorbitant,(adj.),unreasonably high (of a price, demands, etc.),Medium
expeditious,(adj.),speedy and effcient,Medium
extol,(v.),to praise highly,Medium
exuberant,(adj.),cheerfully enthusiastic, full of energy and enthusiasm,Medium
faction,(n.),a smaller, typically opposing group within a larger one,Medium
fallacious,(adj.),based on mistaken ideas or faulty reasoning,Medium
fallacy,(n.),a mistaken belief; faulty reasoning,Medium
fastidious,(adj.),showing high standards or extreme attention to detail, esp. related to cleanliness or neatness,Medium
fathom,(v.),to understand, to comprehend,Medium
fervent,(adj.),having or showing intense feeling,Medium
fervor,(n.),intense feeling,Medium
fester,(v.),to rot; to become worse, esp. as a result of being ignored or neglected,Medium
ﬁtness,(n.),suitability, appropriateness,Medium
