Word,Part of Speech,Definition,Difficulty
myopic,(adj.),shortsighted (lit. or ﬁg.),Hard
myopia,(n.),shortsightedness (lit. or ﬁg.),Hard
nadir,(n.),the lowest or worst point,Hard
nebulous,(adj.),unclear, vague,Hard
neophyte,(n.),a beginner, a person who is new to something,Hard
nettlesome,(adj.),causing annoyance or diffculty,Hard
nexus,(n.),a connection between things, a connected group; a central point or place,Hard
noisome,(adj.),very unpleasant or disgusting, esp. in smell,Hard
nonplussed,(adj.),so surprised and confused that one is unsure of how to react,Hard
noxious,(adj.),harmful, poisonous, or very unpleasant,Hard
nutritive,(adj.),relating to or providing nutrition,Hard
obfuscate,(v.),to make unclear, to make confusing,Hard
obsequious,(adj.),excessively attentive and obedient,Hard
obviate,(v.),to make unnecessary; to prevent from happening,Hard
oeuvre,(n.),all the works of a particular writer, artist, etc.,Hard
offcious,(adj.),annoyingly assertive in oering advice, help, etc.,Hard
opprobrium,(n.),public criticism or public disgrace,Hard
ostentatious,(adj.),intended to attract notice and impress others,Hard
panacea,(n.),a cure-all,Hard
panache,(n.),a stylish, lively, and conﬁdent manner,Hard
paradigm,(n.),a typical example of or model for something; an underlying framework or set of guiding principles,Hard
paragon,(n.),a model of excellence or perfection,Hard
parlay,(v.),to use or develop something to get another thing of greater value,Hard
parochial,(adj.),limited in area, scope, or outlook,Hard
parsimonious,(adj.),extremely unwilling to spend money or use resources,Hard
parsimony,(n.),extreme unwillingness to spend money or use resources,Hard
pastiche,(n.),a varied mix; an artistic work that imitates earlier work,Hard
patronage,(n.),money and support given to an artist, business, etc.,Hard
paucity,(n.),a very small or insuffcient quantity,Hard
peccadillo,(n.),a minor oense,Hard
pedestrian,(adj.),ordinary, boring,Hard
penury,(n.),extreme poverty,Hard
perﬁdious,(adj.),disloyal and untrustworthy,Hard
perﬁdy,(n.),betrayal; disloyalty,Hard
perfunctory,(adj.),done with little eort or interest,Hard
pernicious,(adj.),very harmful, esp. in a gradual or not easliy noticed way,Hard
petulant,(adj.),childishly sulky and irritable,Hard
philistine,(n.),a person who does not care about or understand culture, art, etc.,Hard
phlegmatic,(adj.),not easily excited or upset,Hard
polemic,(n.),a strong written or spoken attack on or defense of an opinion, idea, or person,Hard
polemical,(adj.),expressing a strong attack on or defense of an opinon, idea, or person,Hard
polymath,(n.),a person with great knowledge of numerous subjects,Hard
ponderous,(adj.),slow and heavy (lit. or ﬁg.), esp. boring or clumsy because of those qualities,Hard
portend,(v.),to be a sign of something to come,Hard
prescient,(adj.),able to predict the future,Hard
prescience,(n.),the ability to predict future events,Hard
prevaricate,(v.),to speak in a noncommittal way to avoid the truth,Hard
probity,(n.),integrity, honesty, and strong morals,Hard
proﬂigate,(adj.),extremely wasteful or immoral,Hard
progenitor,(n.),an ancestor; an originator,Hard
prognostication,(n.),a prediction,Hard
prognosticate,(v.),to predict,Hard
prolix,(adj.),using too many words,Hard
prolixity,(n.),the quality of being excessively wordy,Hard
promulgate,(v.),to make widely known,Hard
propitious,(adj.),indicating future success, favorable or promising,Hard
prosaic,(adj.),ordinary or unimaginative,Hard
proscribe,(v.),to forbid or prohibit,Hard
protean,(adj.),changing easily or frequently; versatile,Hard
provident,(adj.),providing for the future,Hard
puerile,(adj.),childishly silly,Hard
pugnacious,(adj.),eager to ﬁght or argue,Hard
punctilious,(adj.),showing great attention to detail or correct behavior,Hard
quash,(v.),to put an end to,Hard
quiescent,(adj.),inactive, at rest,Hard
quixotic,(adj.),foolishly idealistic,Hard
quotidian,(adj.),ordinary; occurring every day,Hard
raconteur,(n.),a skilled storyteller,Hard
rankle,(v.),to cause long-lasting anger or annoyance,Hard
rapacious,(adj.),aggressively greedy,Hard
recalcitrant,(adj.),stubbornly resistant to authority or control,Hard
recondite,(adj.),not well-known; hard to understand,Hard
rectitude,(n.),honesty and moral correctness,Hard
relegate,(v.),to assign to an inferior or insigniﬁcant position, place, etc.,Hard
replete,(adj.),full or well-supplied with something,Hard
repudiate,(v.),to refuse to accept; to reject,Hard
restive,(adj.),unable to stay still or be patient, restless,Hard
rife,(adj.),common, frequent, or widespread, esp. of something undesirable,Hard
rote,(adj.),learned or memorized through repetition, often without understanding,Hard
rote,(n.),unthinking repetition or memorization (for the purpose of learning),Hard
sage,(n.),a very wise person,Hard
sagacious,(adj.),wise and insightful,Hard
salutary,(adj.),beneﬁcial, esp. to health,Hard
sanctimonious,(adj.),acting morally superior,Hard
sanctimony,(n.),the act of behaving as if one is morally superior to others,Hard
sanction,(v.),to permit or offcially approve of,Hard
sanguine,(adj.),optimistic, esp. in a bad situation,Hard
savant,(n.),a person of great learning, a scholar,Hard
sedulous,(adj.),showing careful and persistent eort,Hard
seismic,(adj.),relating to earthquakes; enormous in size or eect,Hard
sententious,(adj.),excessively moralizing, preachy,Hard
serendipity,(n.),unexpected good luck,Hard
serpentine,(adj.),curving or winding like a snake (lit. or ﬁg.); overly complicated,Hard
sophistic,(adj.),seemingly valid but actually invalid,Hard
soporiﬁc,(adj.),causing sleep or drowsiness,Hard
staid,(adj.),serious and sedate, esp. in a boring and old-fashioned way,Hard
stalwart,(adj.),loyal and dependable; strong and sturdy,Hard
stultify,(v.),to cause to be slow, unenthusiastic, or blunted,Hard
surfeit,(n.),an excessive amount,Hard
swathe,(n.),a large strip or area, esp. of land,Hard
taciturn,(adj.),not talkative,Hard
tawdry,(adj.),showy but of low quality; immoral or distasteful,Hard
tendentious,(adj.),favoring a particular point of view, esp. a controversial one; biased,Hard
timorous,(adj.),fearful,Hard
titular,(adj.),having a title but no real power or responsibilities; mentioned in the title (of a character or thing that a book, ﬁlm, etc., is named after),Hard
torpor,(n.),a state of mental and physical inactivity, extreme sluggishness,Hard
tractable,(adj.),easy to manage, control, or deal with,Hard
trappings,(n.),the visible signs of something; the objects, possessions, or features typically associated with a situation, role, etc.,Hard
trope,(n.),a common or overused theme,Hard
truculent,(adj.),quickly angered and eager to argue, aggressively argumentative,Hard
tyro,(n.),a beginner,Hard
ubiquitous,(adj.),present everywhere,Hard
umbrage,(n.),oense, a feeling of annoyance,Hard
upbraid,(v.),to criticize severly, to scold,Hard
vapid,(adj.),boring because showing no intelligence or imagination,Hard
venal,(adj.),willing to behave dishonestly for money, corrupt,Hard
verisimilitude,(n.),the quality of seeming true or real,Hard
verve,(n.),energy and enthusiasm,Hard
vitiate,(v.),to make defective or ineective,Hard
vituperation,(n.),angry and abusive criticism,Hard
yoke,(n.),something oppressive or burdensome; a tie or link,Hard
