Word,Part of Speech,Definition,Difficulty
ﬂorid,(adj.),overly elaborate,Medium
fodder,(n.),low-quality or readily available material used to meet a high demand (lit. food for livestock),Medium
foolhardy,(adj.),foolishly bold or adventurous, reckless,Medium
forestall,(v.),to prevent by taking action beforehand,Medium
frank,(adj.),honest and direct,Medium
galvanize,(v.),to stimulate or excite into taking action,Medium
goad,(v.),to urge or provoke,Medium
grandiose,(adj.),over the top; large and impressive, esp. excessively or impractically,Medium
grapple,(v.),to wrestle (lit. or ﬁg.), to struggle with (a problem, etc.),Medium
gratifying,(adj.),satisfying,Medium
gratify,(v.),to satisfy,Medium
grave,(adj.),very serious,Medium
grudging,(adj.),reluctant,Medium
heed,(v.),to pay attention to (advice, a warning, etc.),Medium
heterogeneous,(adj.),consisting of diverse components,Medium
homogeneous,(adj.),composed of elements that are all similar or identical,Medium
homogenize,(v.),to make something the same throughout,Medium
hyperbole,(n.),exaggeration,Medium
hyperbolic,(adj.),exaggerated,Medium
hypocrisy,(n.),behavior that contradicts one’s stated views,Medium
hypocritical,(adj.),behaving in a way that contradicts one’s stated views,Medium
idiosyncrasy,(n.),a quirk, an unusual behavior or characteristic unique to one person or thing,Medium
idiosyncratic,(adj.),unique to one person or thing (of a behavior or characteristic),Medium
illicit,(adj.),illegal, not permitted,Medium
immutable,(adj.),unchangeable or unchanging,Medium
impassive,(adj.),not feeling or showing emotion,Medium
imperceptible,(adj.),too small to perceive, unnoticeable,Medium
imperious,(adj.),overbearingly and arrogantly controlling,Medium
impertinent,(adj.),rude and disrespectful,Medium
impetus,(n.),a driving force or motive,Medium
implicit,(adj.),understood without being stated,Medium
improvident,(adj.),not providing for the future, esp. ﬁnancially,Medium
imprudent,(adj.),not sensible, unwise,Medium
imprudence,(n.),a lack of wise and sensible judgment,Medium
impudent,(adj.),rude and disrespectful,Medium
impudence,(n.),rude and disrespectful behavior,Medium
inadvertent,(adj.),unintentional,Medium
incendiary,(adj.),causing ﬁre; stirring up conﬂict or anger,Medium
incense,(v.),to make angry,Medium
incessant,(adj.),never stopping, continuous,Medium
incongruous,(adj.),out of place, incompatible,Medium
incongruity,(n.),a lack of harmony between things, incompatibility,Medium
incredulous,(adj.),unwilling or unable to believe something,Medium
indefatigable,(adj.),tireless,Medium
indelible,(adj.),permanent; unforgettable,Medium
indigenous,(adj.),native,Medium
indignant,(adj.),angry because of something unfair or wrong,Medium
indiscriminate,(adj.),not done or chosen in a careful way, unrestrained or at random,Medium
indolent,(adj.),lazy, prone to laziness,Medium
inert,(adj.),not moving,Medium
infatuate,(v.),to ﬁll with intense and often short-lived love or admiration,Medium
ingenious,(adj.),clever and inventive,Medium
ingrained,(adj.),ﬁrmly established or deeply embedded,Medium
innocuous,(adj.),harmless,Medium
inordinate,(adj.),excessive, unusually or disproportionately large,Medium
inscrutable,(adj.),impossible to understand or interpret,Medium
insidious,(adj.),harmful in a gradual or not easliy noticed way,Medium
insipid,(adj.),uninteresting, unexciting,Medium
insoluble,(adj.),impossible to solve; incapable of being dissolved in liquid,Medium
insular,(adj.),interested in only one’s own country or group; isolated,Medium
interloper,(n.),a person who inserts oneself into a situation in which s/he is unwelcome or doesn’t belong, an intruder,Medium
intractable,(adj.),very diffcult or impossible to control, manage, or solve,Medium
intransigent,(adj.),very stubborn,Medium
intransigence,(n.),stubbornness, unwillingness to change,Medium
intrepid,(adj.),fearless, bold and brave,Medium
intriguing,(adj.),very interesting, esp. because it is mysterious; arousing curiosity,Medium
ironclad,(adj.),impossible to break or challenge (of a guarantee, argument, rule, etc.),Medium
irresolute,(adj.),indecisive,Medium
irreverent,(adj.),lacking proper respect for people or things that are generally taken seriously,Medium
itinerant,(adj.),traveling from place to place,Medium
judicious,(adj.),showing good judgment, sensible,Medium
lackadaisical,(adj.),lazy and unenthusiastic, half-hearted; carelessly lazy,Medium
languish,(v.),to be or become weak; to exist in a state of unpleasantness or neglect,Medium
largesse,(n.),generous giving of money or gifts,Medium
laud,(v.),to praise highly, esp. publically laudable/ laudatory,Medium
laud,(adj.),deserving praise/expressing praise,Medium
levity,(n.),humor and lightheartedness, esp. when seriousness is expected,Medium
lionize,(v.),to give a lot of public attention and approval,Medium
lucid,(adj.),clear and easy to understand (of speech, writing, etc.); able to think or express oneself clearly (of a person),Medium
lurid,(adj.),shocking, esp. in a way that causes horror or disgust,Medium
magnanimous,(adj.),generous and forgiving,Medium
magnanimity,(n.),generosity and kindness, a forgiving disposition,Medium
maladroit,(adj.),unskilled, awkward and clumsy,Medium
meander,(v.),to follow a winding course (lit. or ﬁg.); to wander without purpose (lit. or ﬁg.),Medium
mesmerize,(v.),to hold the complete attention of,Medium
mire,(v.),to cause to become stuck in mud (lit. or ﬁg.); to trap in a diffcult situation,Medium
misconstrue,(v.),to interpret (something, such as a statement) wrongly,Medium
misnomer,(n.),a wrong or inaccurate name,Medium
mollify,(v.),to make (someone) less angry or upset; to make less severe,Medium
mount,(v.),to organize and begin (an activity, etc.); to increase in amount,Medium
multifarious,(adj.),of many dierent types,Medium
nominal,(adj.),very small, insigniﬁcant; existing in name only,Medium
nonchalant,(adj.),calm and unconcerned,Medium
omnipresent,(adj.),present everywhere,Medium
omniscient,(adj.),all-knowing,Medium
orthodox,(adj.),traditional, conventional,Medium
orthodoxy,(n.),established or generally accepted beliefs,Medium
outmoded,(adj.),out of style; outdated,Medium
outstrip,(v.),to go faster than, to exceed,Medium
overwrought,(adj.),overly elaborate or complicated, done to excess; very upset or agitated,Medium
palpable,(adj.),able to be touched or noticed; obvious,Medium
pantheon,(n.),an group of important or notable people or things,Medium
paradox,(n.),something seemingly contradictory but true or possible, a person or thing that has seemingly contradictory qualities,Medium
paradoxical,(adj.),self-contradictory,Medium
pariah,(n.),a person who is despised and rejected by others; an outcast,Medium
pastoral,(adj.),of the countryside, esp. its pleasant peacefulness,Medium
patent,(adj.),obvious,Medium
pedantic,(adj.),nitpicky,Medium
pedant,(n.),one who makes a show of knowledge, esp. by correcting small errors or emphasizing minor details in an annoying way,Medium
pejorative,(adj.),expressing disapproval or criticism (of a word or phrase),Medium
pejorative,(n.),a word or phrase that expresses disapproval or criticism,Medium
pious,(adj.),devoutly religious,Medium
pithy,(adj.),using few words but well-expressed,Medium
plaintive,(adj.),sad and mournful, sorrowful,Medium
plastic,(adj.),easily shapable,Medium
platitude,(n.),an overused and thus uninteresting statement,Medium
plethora,(n.),a large or excessive amount,Medium
plodding,(adj.),slow and boring,Medium
plummet,(v.),to fall quickly,Medium
poignant,(adj.),evoking tender sadness, touching,Medium
poignancy,(n.),the quality of deeply aecting the feelings, esp. in a way that evokes sadness,Medium
polarize,(v.),to divide into two contrasting groups, or to cause to become divided in such a way,Medium
polarization,(n.),division into two contrasting groups,Medium
pragmatic,(adj.),practical and sensible,Medium
precipitate,(v.),to cause to happen suddenly,Medium
precipitous,(adj.),dangerously steep; sudden and steep (of a decline, etc.),Medium
preclude,(v.),to prevent something from happening, to prevent somebody from doing something,Medium
precocious,(adj.),exhibiting qualities or abilities of an adult at an unusually early age,Medium
proclivity,(n.),a tendency, esp. toward something bad,Medium
prodigal,(adj.),foolishly wasteful with money, resources, etc.,Medium
prodigious,(adj.),impressively large or great,Medium
prodigy,(n.),a young person of exceptional talent in a particular domain,Medium
profuse,(adj.),in very large amounts,Medium
profusion,(n.),a very large amount,Medium
provincial,(adj.),narrow-minded and unsophisticated; small-town,Medium
prowess,(n.),great skill or ability,Medium
prudent,(adj.),showing wise judgment,Medium
prudence,(n.),careful and wise judgment,Medium
purport,(v.),to appear or claim to be or do something, esp. falsely,Medium
quandary,(n.),a state of uncertainty or confusion; a diffcult situation,Medium
quintessential,(adj.),typical, most perfect of its kind,Medium
rapport,(n.),a friendly relationship, esp. involving good communication,Medium
rebut,(v.),to disprove or deny, to counter,Medium
rebuke,(v.),to scold or criticize sharply,Medium
rectify,(v.),to make right, to correct,Medium
redouble,(v.),to intensify or greatly increase,Medium
reiterate,(v.),to repeat a statement in order to emphasize it,Medium
remedial,(adj.),intended as a remedy or cure; intended for students with learning diffculties,Medium
reprisal,(n.),an act of retaliation or revenge,Medium
reproach,(v.),to scold,Medium
rescind,(v.),to revoke, repeal, or cancel,Medium
respite,(n.),a short period of rest or relief from something diffcult or unpleasant,Medium
reticent,(adj.),reluctant to reveal one’s thoughts or feelings,Medium
reticence,(n.),an unwillingness to reveal one’s thoughts or feelings,Medium
revamp,(v.),to revise, remake, or renovate,Medium
revel,(v.),to take great pleasure in; to engage in unrestrained festivity, to party noisily,Medium
revere,(v.),to greatly admire and respect,Medium
rhetoric,(n.),language intended to persuade or inﬂuence,Medium
rhetorical,(adj.),relating to or concerned with the art of eective or persuasive speech or writing,Medium
salable,(adj.),able or ﬁt to be sold,Medium
salient,(adj.),relevant, most noticeable, or most important,Medium
salience,(n.),relevance, prominence, or importance,Medium
satire,(n.),the use of humor, sarcasm, and/or exaggeration to criticize the faults of someone or something; a piece of writing or performance that uses these tactics,Medium
satirize,(v.),to mock and criticize,Medium
satirical,(adj.),humorously critical in a mocking or sarcastic way,Medium
schism,(n.),a split or division, esp. because of disagreement,Medium
scintillating,(adj.),sparkling and brilliant (lit. or ﬁg.); very interesting, clever, and exciting,Medium
scoff,(v.),to dismiss as silly or stupid (in speech or writing),Medium
secular,(adj.),not religious or spiritual,Medium
siphon,(v.),to draw or transfer from a source, to drain (into something else),Medium
slew,(n.),a large amount,Medium
slight,(n.),an insulting act of disrespect,Medium
slight,(v.),to treat as unimportant,Medium
solicitous,(adj.),showing care and concern for the needs of others, attentive,Medium
solvent,(adj.),able to pay one’s debts,Medium
spurious,(adj.),false or fake, esp. in a deceitful way; based on false ideas or faulty reasoning (of an argument, etc.),Medium
stilted,(adj.),(of speech or writing) sti and unnatural-seeming, too formal,Medium
stinting,(adj.),stingy,Medium
stint,(v.),to be stingy,Medium
stoic,(adj.),not complaining or showing feelings, accepting events without emotion,Medium
stopgap,(n.),a temporary measure or solution,Medium
strife,(n.),angry or bitter disagreement or conﬂict,Medium
subservient,(adj.),very submissive; less important than something or someone else,Medium
subvert,(v.),to weaken or make less eective,Medium
suffuse,(v.),to spread throughout and ﬁll every part of (lit. or ﬁg.),Medium
supersede,(v.),to take the place of, to replace, esp. something older or less useful,Medium
supplant,(v.),to take the place of,Medium
supple,(adj.),bending and moving easily and gracefully, ﬂexible,Medium
surmise,(v.),to suppose something is true without strong evidence,Medium
surreal,(adj.),so bizarre that it doesn’t seem real, dreamlike,Medium
surreptitious,(adj.),done secretly,Medium
sycophant,(n.),a suck-up,Medium
synonymous,(adj.),basically the same in meaning or implication,Medium
taboo,(n.),something that is not socially acceptable to do or talk about, or a prohibition on such a thing,Medium
tacit,(adj.),understood without being stated,Medium
tact,(n.),skillful inoensiveness in speech or manners, esp. when dealing with sensitive issues,Medium
tactful,(adj.),skillfully inoensive in dealing with others,Medium
tangential,(adj.),slightly or indirectly related; of minor or secondary importance or relevance,Medium
temper,(n.),to make less extreme or balance out by adding something else,Medium
temperate,(adj.),mild or moderate, not extreme,Medium
tenable,(adj.),able to be maintained or defended,Medium
titillate,(v.),to interest or excite, esp. in a sexual way,Medium
transﬁx,(v.),to render motionless, as with amazement, fear, etc.,Medium
transgression,(n.),a violation of a law, rule, or code of conduct,Medium
transgressive,(adj.),violating legal, social, or moral boundaries,Medium
transient,(adj.),short-lived, passing,Medium
transitory,(adj.),temporary,Medium
treacherous,(adj.),involving betrayal; having hidden dangers,Medium
treachery,(n.),betrayal,Medium
triﬂing,(adj.),insigniﬁcant, unimportant, of little value,Medium
trite,(adj.),unoriginal and overused,Medium
truncate,(v.),to shorten, to cut short,Medium
tumultuous,(adj.),noisy and excited; full of ups and downs or violent disorder,Medium
tumult,(n.),a disorderly and often noisy situation,Medium
typify,(v.),to be a typical or representative example of,Medium
uncanny,(adj.),strange or mysterious, esp. in a seemingly supernatural way,Medium
unencumbered,(adj.),free from burdens, restrictions, or obstacles,Medium
unﬂappable,(adj.),able to stay calm and composed in a diffcult situation,Medium
unremitting,(adj.),never stopping or weakening,Medium
unvarnished,(adj.),plain and straightforward,Medium
unwieldy,(adj.),diffcult to handle, manage, or use because of size, shape, complexity, etc.,Medium
urbane,(adj.),well-mannered and conﬁdent, polished and polite,Medium
utilitarian,(adj.),designed to be useful or practical rather than attractive,Medium
venerate,(v.),regard or treat with deep respect,Medium
venerable,(adj.),worthy of respect because of age, character, position, etc.,Medium
veracity,(n.),truthfulness, accuracy,Medium
veracious,(adj.),truthful, honest, accurate,Medium
virtuoso,(n.),a person who is highly skilled at something,Medium
virtuoso,(adj.),highly skilled, masterful,Medium
vociferous,(adj.),loud and forceful (of demands, opinions, etc.),Medium
whitewash,(v.),to try to make something seem not as bad as it was, to downplay or hide unpleasant facts about something,Medium
xenophobic,(adj.),having or showing fear or dislike of foreigners,Medium
xenophobia,(n.),fear or hatred of foreigners,Medium
abet,(v.),to help or encourage someone to do something, esp. something wrong or illegal,Hard
abstruse,(adj.),diffcult to understand,Hard
acolyte,(n.),a person who follows and assists a leader or important person,Hard
acquisitive,(adj.),excessively interested in acquiring money or material things, greedy,Hard
acuity,(n.),ability to see, hear, or think clearly,Hard
acumen,(n.),ability to make good decisions in a particular domain,Hard
agrarian,(adj.),relating to farming, agricultural,Hard
alacrity,(n.),speed and eagerness,Hard
amalgam,(n.),a mixture in which the distinct elements are not lost,Hard
amalgamate,(v.),to combine into a single entity, to integrate,Hard
amity,(n.),a friendly relationship,Hard
anachronism,(n.),a person or thing placed in the wrong time period (in ﬁlm, books, etc.); something that is appropriate to an earlier period in history,Hard
anachronistic,(adj.),belonging to a period other than the one portrayed; appropriate to an earlier period in history,Hard
analogous,(adj.),comparable, similar,Hard
analogue,(n.),something that is similar or comparable to something else,Hard
animus,(n.),a strong feeling of hate or anger,Hard
antedate,(v.),to precede in time, to predate,Hard
apostate,(n.),a person who abandons a religion, political party, cause, etc.,Hard
approbation,(n.),approval, praise,Hard
apropos,(adj.),relevant or appropriate to a particular situation, discussion, etc.,Hard
arcane,(adj.),known or understood by few people, secret and mysterious,Hard
archetype,(n.),an original model or perfect example of something,Hard
artful,(adj.),clever or skillful, esp. in a dishonest way,Hard
artless,(adj.),honest and natural; without skill,Hard
ascetic,(adj.),harshly self-denying of pleasures; harshly simple and without comforts or pleasures,Hard
assiduous,(adj.),careful and persistent,Hard
astringent,(adj.),sharply acidic or bitter (lit. or ﬁg.); harshly critical in a clever way,Hard
augur,(v.),to be a sign of something to come,Hard
avarice,(n.),greed,Hard
aver,(v.),to state that something is true,Hard
blithe,(adj.),happy and carefree,Hard
bridle,(n.),a restraint,Hard
bridle,(v.),to restrain or keep in check,Hard
brook,(v.),to put up with or tolerate, esp. opposition,Hard
bucolic,(adj.),pleasantly rural or relating to the countryside,Hard
buoy,(v.),to support, to uplift; to raise the spirits of,Hard
byzantine,(adj.),excessively complicated; involving devious and secretive methods,Hard
cacophony,(n.),a loud and unpleasant mix of sounds,Hard
cacophonous,(adj.),involving or producing a loud and unpleasant mix of sounds,Hard
cajole,(v.),to persuade, esp. by ﬂattery,Hard
canonize,(v.),to regard as among the most accomplished and important works (of literature, etc.),Hard
canon,(n.),works (of literature, etc.) generally regarded as the most accomplished and important,Hard
capitulate,(v.),to surrender,Hard
castigate,(v.),to scold severely,Hard
cathartic,(adj.),emotionally relieving catharsis an emotional release that results in a feeling of relief,Hard
catholic,(adj.),including many dierent things, all-encompassing,Hard
cavalier,(adj.),showing no concern for important matters, dismissive,Hard
censure,(v.),to offcially express strong disapproval of,Hard
censure,(n.),strong offcial disapproval,Hard
chary,(adj.),cautious,Hard
chicanery,(n.),trickery, esp. in politics or ﬁnance,Hard
churlish,(adj.),rude and unfriendly,Hard
cipher,(n.),a code, a disguised way of writing,Hard
circumlocution,(n.),the use of more words than needed, esp. when being deliberately vague; saying things in a roundabout way,Hard
cloying,(adj.),sickeningly sweet or sentimental,Hard
comity,(n.),friendliness and courteous behavior,Hard
corollary,(n.),something that naturally follows from something else, a natural result,Hard
coterie,(n.),a small group of people uniﬁed by a common interest or purpose,Hard
craven,(adj.),very cowardly,Hard
credence,(n.),acceptance of something as true; plausibility, credibility,Hard
dalliance,(n.),a brief, casual involvement with something or relationship with someone,Hard
debar,(v.),to prohibit or ban,Hard
demur,(v.),to object,Hard
demure,(adj.),reserved and modest,Hard
desultory,(adj.),lacking a plan, purpose, or serious eort; aimless or random,Hard
diffdent,(adj.),shy and lacking in self-conﬁdence,Hard
dilatory,(adj.),slow to act; causing delay,Hard
dilettante,(n.),a person who takes part in an activity without real commitment or deep knowledge, a dabbler,Hard
dirge,(n.),a song of grief or mourning,Hard
disapprobation,(n.),strong disapproval,Hard
discomﬁt,(v.),to make uneasy or embarrassed,Hard
discursive,(adj.),rambling, going from topic to topic (of speech or writing),Hard
disquiet,(v.),to make uneasy or worried,Hard
dissolute,(adj.),lacking moral restraint,Hard
droll,(adj.),amusing in an odd way,Hard
echelon,(n.),a level or rank (in a society, profession, etc.),Hard
edify,(v.),to inform or enlighten, to teach,Hard
ediﬁcation,(n.),improvement of the mind, morals, or character, often through instruction,Hard
egregious,(adj.),extremely bad in a noticeable way,Hard
elide,(v.),to omit,Hard
enervate,(v.),to cause to feel weak and drained of energy,Hard
enigmatic,(adj.),mysterious, diffcult to understand or interpret,Hard
enmity,(n.),hatred, hostility,Hard
equanimity,(n.),mental and emotional calmness and composure; even temper,Hard
ersatz,(adj.),faux or imitation, esp. when inferior to the real thing,Hard
esoteric,(adj.),intended for or understood by a small group of people,Hard
euphony,(n.),a pleasing or harmonious sound,Hard
evanescent,(adj.),short-lived, disappearing quickly,Hard
evanescence,(n.),the quality of lasting for a very short time or quickly disappearing,Hard
evince,(v.),to show clearly; to make evident,Hard
exculpate,(v.),to prove or declare (someone) not guilty,Hard
exigent,(adj.),demanding immediate attention, urgent,Hard
existential,(adj.),relating to existence,Hard
explicate,(v.),to explain in detail,Hard
extemporaneous,(adj.),done or spoken without preparation, improvised,Hard
facetious,(adj.),joking or humorous, esp. inappropriately,Hard
fecund,(adj.),fertile,Hard
ﬂippant,(adj.),lacking respectfulness or seriousness,Hard
ﬂummox,(v.),to greatly confuse,Hard
foment,(v.),to encourage or cause the development of (trouble, rebellion, etc.),Hard
forbearance,(n.),patience and restraint; leniency,Hard
frenetic,(adj.),fast and energetic in a wild or disordered way,Hard
gainsay,(v.),to deny, dispute, or contradict,Hard
garrulous,(adj.),excessively talkative,Hard
gauche,(adj.),lacking social grace, socially awkward,Hard
germane,(adj.),relevant,Hard
glib,(adj.),smooth but insincere and shallow (of words or a person speaking),Hard
guile,(n.),skillful deceit,Hard
hackneyed,(adj.),overused, unoriginal,Hard
harbinger,(n.),a sign of something to come,Hard
harrow,(v.),to distress, to torment,Hard
hedonism,(n.),pursuit of and indulgence in pleasure,Hard
hermetic,(adj.),isolated or closed o from outside inﬂuence; airtight,Hard
heterodox,(adj.),dierent from generally accepted beliefs or standards,Hard
hidebound,(adj.),rigidly conservative,Hard
histrionic,(adj.),emotional in an exaggerated way, melodramatic,Hard
homage,(n.),expression of respect or honor,Hard
hoodwink,(v.),to deceive or trick,Hard
iconoclast,(n.),a person who attacks established ideas or institutions,Hard
iconoclastic,(adj.),attacking established ideas or institutions,Hard
ignoble,(adj.),dishonorable, shameful,Hard
imbue,(v.),to ﬁll (with a feeling or quality),Hard
impassive,(adj.),emotionless,Hard
impecunious,(adj.),having little or no money,Hard
impervious,(adj.),not able to be penetrated or aected,Hard
impetuous,(adj.),impulsive,Hard
implacable,(adj.),not able to be satisﬁed or stopped,Hard
impolitic,(adj.),unwise, esp. in social situations,Hard
impugn,(v.),to attack as false or questionable (a statement, motives, etc.),Hard
incontrovertible,(adj.),undeniable,Hard
indemnify,(v.),to compensate for a loss or damage,Hard
ingenuous,(adj.),innocent and trusting,Hard
inimical,(adj.),harmful or unfriendly,Hard
intelligible,(adj.),understandable,Hard
inveterate,(adj.),habitual or long-established and unlikely to change,Hard
irascible,(adj.),easily angered,Hard
irony,(n.),a use of words that conveys the opposite of their actual meaning, esp. for humorous eect; an outcome that is the opposite of what would be expected given the situation,Hard
jingoistic,(adj.),extremely and often aggressively nationalistic,Hard
kinetic,(adj.),relating to motion,Hard
laconic,(adj.),using few words,Hard
lambaste,(v.),to verbally attack and criticize,Hard
lampoon,(v.),to publicly criticize in a humorous way,Hard
languid,(adj.),slow and relaxed, lacking energy,Hard
languorous,(adj.),pleasantly lazy and lacking energy,Hard
libertine,(n.),someone who lives without morals, esp. in pursuit of sexual pleasure,Hard
limpid,(adj.),transparent; clear and simple,Hard
loquacious,(adj.),talkative,Hard
lugubrious,(adj.),sad and gloomy,Hard
machination,(n.),a clever scheme or plot, often with an evil purpose,Hard
malinger,(v.),to pretend to be sick to avoid work or responsibilities,Hard
malingerer,(n.),a person who pretends to be sick to avoid work or responsibilities,Hard
martinet,(n.),a person who demands strict following of rules,Hard
maudlin,(adj.),excessively sentimental,Hard
maverick,(n.),a person who shows independence of thought and action,Hard
maverick,(adj.),characterized by independence of thought and action,Hard
mawkish,(adj.),overly sentimental,Hard
melliﬂuous,(adj.),having a pleasant and ﬂowing sound,Hard
mendacity,(n.),untruthfulness,Hard
mendacious,(adj.),lying, esp. habitually,Hard
mercenary,(adj.),concerned only with making money, esp. without regard for ethics,Hard
mercenary,(n.),someone concerned only with making money, esp. without regard for ethics; a soldier paid to ﬁght for a foreign country,Hard
mercurial,(adj.),unpredictable, changing suddenly and often,Hard
misanthrope,(n.),a person who dislikes or distrusts other people,Hard
miscreant,(n.),a person who behaves badly or breaks the law,Hard
modish,(adj.),fashionable, stylish,Hard
mordant,(adj.),sharply critical, esp. in a humorous way,Hard
mores,(n.),the customs and conventions of a group,Hard
motif,(n.),a recurring or central theme (in a book or work of art); a design element or pattern in a design,Hard
